### ISSUE TITLE
Routes docker daemon --bip value

### ISSUE THREAD

**Issue by abriko** [kubeup/kube-aliyun#3]
Hi, README say:

> Pass --bip={subnet} and --ip-masq=false to docker daemon

My k8s cluster cidr is 10.2.0.0/16, node  ip is 10.0.4.10 10.0.4.11 10.0.4.12.  so what value should we place on subnet?

**Comment by adieu** [comment]
`subnet` should be your pod ip range which should be `10.2.0.0/16`.

If you use `kubenet` as the network plugin, you don't have to configure docker daemon at all.

**Comment by ledzep2** [comment]
@HuPonya @adieu In fact it should be 10.2.0.1/16. `--bip value` sets the bridge ip which docker will use and calculate subnet from. And x.x.x.0 is reserved in aliyun if my memory is correct

**Comment by abriko** [comment]
Hi Guys,
I have question of kube-aliyun networking. I using **kube-aliyun** and **hostroutes** in aliyun vpc, but my pod can't access any address.

I found route table have a duplicate route:

> n2 ~ # ip r
default via 10.0.4.253 dev eth0  proto static 
10.0.4.0/24 dev eth0  proto kernel  scope link  src 10.0.4.16 
10.2.0.0/24 via 10.0.4.15 dev eth0 
10.2.1.0/24 via 10.0.4.16 dev eth0 
10.2.1.0/24 dev cbr0  proto kernel  scope link  src 10.2.1.1 
10.2.2.0/24 via 10.0.4.17 dev eth0 
172.17.0.0/16 dev docker0  proto kernel  scope link  src 172.17.0.1

I deleted **10.2.1.0/24 via 10.0.4.16 dev eth0**, now pod on this node can access public network but still can't communicate with service IP or other pods on other nodes. So how can I debug this?

kube-proxy logs:

> I0711 14:07:05.323266       1 server.go:215] Using iptables Proxier.
W0711 14:07:05.326198       1 proxier.go:254] clusterCIDR not specified, unable to distinguish between internal and external traffic
I0711 14:07:05.326277       1 server.go:227] Tearing down userspace rules.
I0711 14:07:05.353889       1 conntrack.go:81] Set sysctl 'net/netfilter/nf_conntrack_max' to 131072
I0711 14:07:05.354710       1 conntrack.go:66] Setting conntrack hashsize to 32768
I0711 14:07:05.354940       1 conntrack.go:81] Set sysctl 'net/netfilter/nf_conntrack_tcp_timeout_established' to 86400
I0711 14:07:05.355034       1 conntrack.go:81] Set sysctl 'net/netfilter/nf_conntrack_tcp_timeout_close_wait' to 3600

hostroutes logs:
> E0711 14:07:09.100479       1 hostgw.go:80] Unable to add route: {Ifindex: 0 Dst: 10.2.1.0/24 Src: <nil> Gw: 10.0.4.16}
file exists
E0711 14:07:09.101161       1 hostgw.go:80] Unable to add route: {Ifindex: 0 Dst: 10.2.2.0/24 Src: <nil> Gw: 10.0.4.17}
file exists
E0711 14:07:09.101263       1 hostgw.go:80] Unable to add route: {Ifindex: 0 Dst: 10.2.0.0/24 Src: <nil> Gw: 10.0.4.15}
file exists

iptables:
```
# Generated by iptables-save v1.4.21 on Tue Jul 11 22:27:10 2017
*nat
:PREROUTING ACCEPT [0:0]
:INPUT ACCEPT [0:0]
:OUTPUT ACCEPT [0:0]
:POSTROUTING ACCEPT [0:0]
:DOCKER - [0:0]
:KUBE-HOSTPORTS - [0:0]
:KUBE-MARK-DROP - [0:0]
:KUBE-MARK-MASQ - [0:0]
:KUBE-NODEPORTS - [0:0]
:KUBE-POSTROUTING - [0:0]
:KUBE-SEP-OJL4NVQD4CA7AI5O - [0:0]
:KUBE-SERVICES - [0:0]
:KUBE-SVC-ERIFXISQEP7F7OF4 - [0:0]
:KUBE-SVC-NPX46M4PTMTKRN6Y - [0:0]
:KUBE-SVC-TCOU7JCQXEZGVUNU - [0:0]
-A PREROUTING -m comment --comment "kube hostport portals" -m addrtype --dst-type LOCAL -j KUBE-HOSTPORTS
-A PREROUTING -m comment --comment "kubernetes service portals" -j KUBE-SERVICES
-A PREROUTING -m addrtype --dst-type LOCAL -j DOCKER
-A OUTPUT -m comment --comment "kube hostport portals" -m addrtype --dst-type LOCAL -j KUBE-HOSTPORTS
-A OUTPUT -m comment --comment "kubernetes service portals" -j KUBE-SERVICES
-A OUTPUT ! -d 127.0.0.0/8 -m addrtype --dst-type LOCAL -j DOCKER
-A KUBE-SERVICES -d 10.3.0.10/32 -p udp -m comment --comment "kube-system/kube-dns:dns cluster IP" -m udp --dport 53 -j KUBE-SVC-TCOU7JCQXEZGVUNU
-A KUBE-SERVICES -d 10.3.0.10/32 -p tcp -m comment --comment "kube-system/kube-dns:dns-tcp cluster IP" -m tcp --dport 53 -j KUBE-SVC-ERIFXISQEP7F7OF4
-A KUBE-SERVICES -d 10.3.0.1/32 -p tcp -m comment --comment "default/kubernetes:https cluster IP" -m tcp --dport 443 -j KUBE-SVC-NPX46M4PTMTKRN6Y
-A KUBE-SERVICES -m comment --comment "kubernetes service nodeports; NOTE: this must be the last rule in this chain" -m addrtype --dst-type LOCAL -j KUBE-NODEPORTS
-A KUBE-SVC-NPX46M4PTMTKRN6Y -m comment --comment "default/kubernetes:https" -m recent --rcheck --seconds 10800 --reap --name KUBE-SEP-OJL4NVQD4CA7AI5O --mask 255.255.255.255 --rsource -j KUBE-SEP-OJL4NVQD4CA7AI5O
-A KUBE-SVC-NPX46M4PTMTKRN6Y -m comment --comment "default/kubernetes:https" -j KUBE-SEP-OJL4NVQD4CA7AI5O
COMMIT
# Completed on Tue Jul 11 22:27:10 2017
# Generated by iptables-save v1.4.21 on Tue Jul 11 22:27:10 2017*filter
:INPUT ACCEPT [307:54803]
:FORWARD ACCEPT [0:0]
:OUTPUT ACCEPT [283:86214]
:DOCKER - [0:0]
:DOCKER-ISOLATION - [0:0]:KUBE-FIREWALL - [0:0]
:KUBE-SERVICES - [0:0]
-A INPUT -j KUBE-FIREWALL
-A FORWARD -j DOCKER-ISOLATION
-A FORWARD -o docker0 -j DOCKER
-A FORWARD -o docker0 -m conntrack --ctstate RELATED,ESTABLISHED -j ACCEPT
-A FORWARD -i docker0 ! -o docker0 -j ACCEPT
-A FORWARD -i docker0 -o docker0 -j ACCEPT
-A OUTPUT -m comment --comment "kubernetes service portals" -j KUBE-SERVICES
-A OUTPUT -j KUBE-FIREWALL
-A DOCKER-ISOLATION -j RETURN
-A KUBE-FIREWALL -m comment --comment "kubernetes firewall for dropping marked packets" -m mark --mark 0x8000/0x8000 -j DROP
-A KUBE-SERVICES -d 10.3.0.10/32 -p udp -m comment --comment "kube-system/kube-dns:dns has no endpoints" -m udp --dport 53 -j REJECT --reject-with icmp-port-unreachable
-A KUBE-SERVICES -d 10.3.0.10/32 -p tcp -m comment --comment "kube-system/kube-dns:dns-tcp has no endpoints" -m tcp --dport 53 -j REJECT --reject-with icmp-port-unreachable
COMMIT
# Completed on Tue Jul 11 22:27:10 2017

```

**Comment by adieu** [comment]
@HuPonya in fact, hostroutes doesn't work in aliyun due to limitations in its vpc implementation. i made a mistake written the guide. try remove hostroutes and use kube-aliyun alone. it should configure the vpc route table and enable the pod to pod communication.

**Comment by abriko** [comment]
I deleted hostroutes, this time pod can only ping pod gateway...

route table:
```
n3 ~ # ip r
default via 10.0.4.253 dev eth0  proto static 
10.0.4.0/24 dev eth0  proto kernel  scope link  src 10.0.4.17 
10.2.2.0/24 dev cbr0  proto kernel  scope link  src 10.2.2.1 
172.17.0.0/16 dev docker0  proto kernel  scope link  src 172.17.0.1

```

aliyun-controller logs:
```
6:31:15.451709       1 controller.go:169] Controller is leading. Starting loop
I0712 06:31:15.452661       1 servicecontroller.go:176] Starting service controller
I0712 06:31:15.452839       1 routecontroller.go:80] Starting the route controller
I0712 06:31:15.452881       1 controller.go:249] Starting provisioner controller b4b6b93f-66cb-11e7-bc18-00163e0d744d!
E0712 06:31:15.459008       1 reflector.go:201] kubeup.com/kube-aliyun/vendor/github.com/kubernetes-incubator/external-storage/lib/controller/controller.go:242: Failed to list *v1.StorageClass: the server could not find the requested resource
I0712 06:31:15.553254       1 servicecontroller.go:656] Detected change in list of current cluster nodes. New node set: [10.0.4.16]
I0712 06:31:15.553317       1 servicecontroller.go:664] Successfully updated 0 out of 0 load balancers to direct traffic to the updated set of nodes
E0712 06:31:16.461483       1 reflector.go:201] kubeup.com/kube-aliyun/vendor/github.com/kubernetes-incubator/external-storage/lib/controller/controller.go:242: Failed to list *v1.StorageClass: the server could not find the requested resource
E0712 06:31:17.466555       1 reflector.go:201] kubeup.com/kube-aliyun/vendor/github.com/kubernetes-incubator/external-storage/lib/controller/controller.go:242: Failed to list *v1.StorageClass: the server could not find the requested resource
E0712 06:31:18.468491       1 reflector.go:201] kubeup.com/kube-aliyun/vendor/github.com/kubernetes-incubator/external-storage/lib/controller/controller.go:242: Failed to list *v1.StorageClass: the server could not find the requested resource
E0712 06:31:19.470762       1 reflector.go:201] kubeup.com/kube-aliyun/vendor/github.com/kubernetes-incubator/external-storage/lib/controller/controller.go:242: Failed to list *v1.StorageClass: the server could not find the requested resource
E0712 06:31:20.473382       1 reflector.go:201] kubeup.com/kube-aliyun/vendor/github.com/kubernetes-incubator/external-storage/lib/controller/controller.go:242: Failed to list *v1.StorageClass: the server could not find the requested resource

```

aliyun routes:

![qq 20170712145732](https://user-images.githubusercontent.com/2601077/28105629-dd6bc0ca-6712-11e7-9694-f93a11d2fd89.png)

**Comment by adieu** [comment]
can you do a `tcpdump` in the source and target servers? we have to make sure the packet arrived at the destination server first. it looks that the route table in aliyun is configured correctly.

**Comment by abriko** [comment]
api server tcpdump
```
[root@n1 ~]# tcpdump -i any -n host 10.0.4.17 and port 443 -vvv
tcpdump: listening on any, link-type LINUX_SLL (Linux cooked), capture size 262144 bytes
18:29:19.310322 IP (tos 0x0, ttl 64, id 34405, offset 0, flags [DF], proto TCP (6), length 486)
    10.0.4.15.https > 10.0.4.17.33364: Flags [P.], cksum 0x1df8 (incorrect -> 0xb446), seq 2172476143:2172476577, ack 4075506691, win 1017, options [nop,nop,TS val 1224227066 ecr 457411306], length 434
18:29:19.350872 IP (tos 0x0, ttl 64, id 23964, offset 0, flags [DF], proto TCP (6), length 52)
    10.0.4.17.33364 > 10.0.4.15.https: Flags [.], cksum 0x8b17 (correct), seq 1, ack 434, win 1384, options [nop,nop,TS val 457411531 ecr 1224227066], length 0
18:29:21.139091 IP (tos 0x0, ttl 64, id 34406, offset 0, flags [DF], proto TCP (6), length 480)
    10.0.4.15.https > 10.0.4.17.33364: Flags [P.], cksum 0x1df2 (incorrect -> 0xc077), seq 434:862, ack 1, win 1017, options [nop,nop,TS val 1224228895 ecr 457411531], length 428
18:29:21.139375 IP (tos 0x0, ttl 64, id 23965, offset 0, flags [DF], proto TCP (6), length 52)
    10.0.4.17.33364 > 10.0.4.15.https: Flags [.], cksum 0x7b4a (correct), seq 1, ack 862, win 1384, options [nop,nop,TS val 457413319 ecr 1224228895], length 0
18:29:21.140684 IP (tos 0x0, ttl 64, id 34407, offset 0, flags [DF], proto TCP (6), length 498)
    10.0.4.15.https > 10.0.4.17.33364: Flags [P.], cksum 0x1e04 (incorrect -> 0xf433), seq 862:1308, ack 1, win 1017, options [nop,nop,TS val 1224228897 ecr 457413319], length 446
18:29:21.140896 IP (tos 0x0, ttl 64, id 23966, offset 0, flags [DF], proto TCP (6), length 52)
    10.0.4.17.33364 > 10.0.4.15.https: Flags [.], cksum 0x7988 (correct), seq 1, ack 1308, win 1384, options [nop,nop,TS val 457413321 ecr 1224228897], length 0
18:29:21.324258 IP (tos 0x0, ttl 64, id 34408, offset 0, flags [DF], proto TCP (6), length 486)
    10.0.4.15.https > 10.0.4.17.33364: Flags [P.], cksum 0x1df8 (incorrect -> 0x996a), seq 1308:1742, ack 1, win 1017, options [nop,nop,TS val 1224229080 ecr 457413321], length 434
18:29:21.324467 IP (tos 0x0, ttl 64, id 23967, offset 0, flags [DF], proto TCP (6), length 52)
    10.0.4.17.33364 > 10.0.4.15.https: Flags [.], cksum 0x7668 (correct), seq 1, ack 1742, win 1384, options [nop,nop,TS val 457413504 ecr 1224229080], length 0
18:29:23.160152 IP (tos 0x0, ttl 64, id 34409, offset 0, flags [DF], proto TCP (6), length 480)
    10.0.4.15.https > 10.0.4.17.33364: Flags [P.], cksum 0x1df2 (incorrect -> 0xe70c), seq 1742:2170, ack 1, win 1017, options [nop,nop,TS val 1224230916 ecr 457413504], length 428
18:29:23.160354 IP (tos 0x0, ttl 64, id 23968, offset 0, flags [DF], proto TCP (6), length 52)
    10.0.4.17.33364 > 10.0.4.15.https: Flags [.], cksum 0x6664 (correct), seq 1, ack 2170, win 1384, options [nop,nop,TS val 457415340 ecr 1224230916], length 0
18:29:23.161854 IP (tos 0x0, ttl 64, id 34410, offset 0, flags [DF], proto TCP (6), length 498)
    10.0.4.15.https > 10.0.4.17.33364: Flags [P.], cksum 0x1e04 (incorrect -> 0x51cb), seq 2170:2616, ack 1, win 1017, options [nop,nop,TS val 1224230918 ecr 457415340], length 446
18:29:23.162036 IP (tos 0x0, ttl 64, id 23969, offset 0, flags [DF], proto TCP (6), length 52)
    10.0.4.17.33364 > 10.0.4.15.https: Flags [.], cksum 0x64a2 (correct), seq 1, ack 2616, win 1384, options [nop,nop,TS val 457415342 ecr 1224230918], length 0
18:29:23.335804 IP (tos 0x0, ttl 64, id 34411, offset 0, flags [DF], proto TCP (6), length 486)
    10.0.4.15.https > 10.0.4.17.33364: Flags [P.], cksum 0x1df8 (incorrect -> 0x89b4), seq 2616:3050, ack 1, win 1017, options [nop,nop,TS val 1224231092 ecr 457415342], length 434
18:29:23.336029 IP (tos 0x0, ttl 64, id 23970, offset 0, flags [DF], proto TCP (6), length 52)
    10.0.4.17.33364 > 10.0.4.15.https: Flags [.], cksum 0x6194 (correct), seq 1, ack 3050, win 1384, options [nop,nop,TS val 457415516 ecr 1224231092], length 0
18:29:25.177567 IP (tos 0x0, ttl 64, id 34412, offset 0, flags [DF], proto TCP (6), length 480)
    10.0.4.15.https > 10.0.4.17.33364: Flags [P.], cksum 0x1df2 (incorrect -> 0xab1e), seq 3050:3478, ack 1, win 1017, options [nop,nop,TS val 1224232934 ecr 457415516], length 428
18:29:25.177789 IP (tos 0x0, ttl 64, id 23971, offset 0, flags [DF], proto TCP (6), length 52)
    10.0.4.17.33364 > 10.0.4.15.https: Flags [.], cksum 0x5185 (correct), seq 1, ack 3478, win 1384, options [nop,nop,TS val 457417357 ecr 1224232934], length 0
18:29:25.179796 IP (tos 0x0, ttl 64, id 34413, offset 0, flags [DF], proto TCP (6), length 498)
    10.0.4.15.https > 10.0.4.17.33364: Flags [P.], cksum 0x1e04 (incorrect -> 0x4489), seq 3478:3924, ack 1, win 1017, options [nop,nop,TS val 1224232936 ecr 457417357], length 446
18:29:25.179992 IP (tos 0x0, ttl 64, id 23972, offset 0, flags [DF], proto TCP (6), length 52)
    10.0.4.17.33364 > 10.0.4.15.https: Flags [.], cksum 0x4fc2 (correct), seq 1, ack 3924, win 1384, options [nop,nop,TS val 457417360 ecr 1224232936], length 0
18:29:25.346169 IP (tos 0x0, ttl 64, id 34414, offset 0, flags [DF], proto TCP (6), length 486)
    10.0.4.15.https > 10.0.4.17.33364: Flags [P.], cksum 0x1df8 (incorrect -> 0x94eb), seq 3924:4358, ack 1, win 1017, options [nop,nop,TS val 1224233102 ecr 457417360], length 434
18:29:25.346382 IP (tos 0x0, ttl 64, id 23973, offset 0, flags [DF], proto TCP (6), length 52)
    10.0.4.17.33364 > 10.0.4.15.https: Flags [.], cksum 0x4cc4 (correct), seq 1, ack 4358, win 1384, options [nop,nop,TS val 457417526 ecr 1224233102], length 0
18:29:26.085114 IP (tos 0x0, ttl 64, id 15333, offset 0, flags [DF], proto TCP (6), length 97)
    10.0.4.17.33358 > 10.0.4.15.https: Flags [P.], cksum 0x2e65 (correct), seq 4119205422:4119205467, ack 3698809196, win 1384, options [nop,nop,TS val 457418265 ecr 1224223841], length 45
18:29:26.086953 IP (tos 0x0, ttl 64, id 56584, offset 0, flags [DF], proto TCP (6), length 117)
    10.0.4.15.https > 10.0.4.17.33358: Flags [P.], cksum 0x1c87 (incorrect -> 0xbfd2), seq 1:66, ack 45, win 1392, options [nop,nop,TS val 1224233843 ecr 457418265], length 65
18:29:26.087114 IP (tos 0x0, ttl 64, id 56585, offset 0, flags [DF], proto TCP (6), length 2694)
    10.0.4.15.https > 10.0.4.17.33358: Flags [P.], cksum 0x2698 (incorrect -> 0x1fbd), seq 66:2708, ack 45, win 1392, options [nop,nop,TS val 1224233843 ecr 457418265], length 2642
18:29:26.087347 IP (tos 0x0, ttl 64, id 15334, offset 0, flags [DF], proto TCP (6), length 52)
    10.0.4.17.33358 > 10.0.4.15.https: Flags [.], cksum 0x2709 (correct), seq 45, ack 2708, win 1384, options [nop,nop,TS val 457418267 ecr 1224233843], length 0
18:29:26.089325 IP (tos 0x0, ttl 64, id 15335, offset 0, flags [DF], proto TCP (6), length 99)
    10.0.4.17.33358 > 10.0.4.15.https: Flags [P.], cksum 0x8536 (correct), seq 45:92, ack 2708, win 1384, options [nop,nop,TS val 457418269 ecr 1224233843], length 47
18:29:26.089456 IP (tos 0x0, ttl 64, id 15336, offset 0, flags [DF], proto TCP (6), length 2678)
    10.0.4.17.33358 > 10.0.4.15.https: Flags [P.], cksum 0x2688 (incorrect -> 0x0765), seq 92:2718, ack 2708, win 1384, options [nop,nop,TS val 457418269 ecr 1224233843], length 2626
18:29:26.089613 IP (tos 0x0, ttl 64, id 15338, offset 0, flags [DF], proto TCP (6), length 90)
    10.0.4.17.33358 > 10.0.4.15.https: Flags [P.], cksum 0x5db1 (correct), seq 2718:2756, ack 2708, win 1384, options [nop,nop,TS val 457418269 ecr 1224233843], length 38
18:29:26.089798 IP (tos 0x0, ttl 64, id 56587, offset 0, flags [DF], proto TCP (6), length 52)
    10.0.4.15.https > 10.0.4.17.33358: Flags [.], cksum 0x1c46 (incorrect -> 0x1c65), seq 2708, ack 2756, win 1392, options [nop,nop,TS val 1224233846 ecr 457418269], length 0
18:29:26.090816 IP (tos 0x0, ttl 64, id 56588, offset 0, flags [DF], proto TCP (6), length 120)
    10.0.4.15.https > 10.0.4.17.33358: Flags [P.], cksum 0x1c8a (incorrect -> 0x5cd2), seq 2708:2776, ack 2756, win 1392, options [nop,nop,TS val 1224233847 ecr 457418269], length 68
18:29:26.100897 IP (tos 0x0, ttl 64, id 56589, offset 0, flags [DF], proto TCP (6), length 2695)
    10.0.4.15.https > 10.0.4.17.33358: Flags [P.], cksum 0x2699 (incorrect -> 0xc4f8), seq 2776:5419, ack 2756, win 1392, options [nop,nop,TS val 1224233857 ecr 457418269], length 2643
18:29:26.101174 IP (tos 0x0, ttl 64, id 15339, offset 0, flags [DF], proto TCP (6), length 52)
    10.0.4.17.33358 > 10.0.4.15.https: Flags [.], cksum 0x1674 (correct), seq 2756, ack 4224, win 1384, options [nop,nop,TS val 457418281 ecr 1224233847], length 0
18:29:26.101459 IP (tos 0x0, ttl 64, id 15340, offset 0, flags [DF], proto TCP (6), length 94)
    10.0.4.17.33358 > 10.0.4.15.https: Flags [P.], cksum 0x6df1 (correct), seq 2756:2798, ack 5419, win 1384, options [nop,nop,TS val 457418281 ecr 1224233857], length 42
18:29:26.101853 IP (tos 0x0, ttl 64, id 56591, offset 0, flags [DF], proto TCP (6), length 2683)
    10.0.4.15.https > 10.0.4.17.33358: Flags [P.], cksum 0x268d (incorrect -> 0x239b), seq 5419:8050, ack 2798, win 1392, options [nop,nop,TS val 1224233858 ecr 457418281], length 2631
18:29:26.102100 IP (tos 0x0, ttl 64, id 15341, offset 0, flags [DF], proto TCP (6), length 52)
    10.0.4.17.33358 > 10.0.4.15.https: Flags [.], cksum 0x074c (correct), seq 2798, ack 8050, win 1384, options [nop,nop,TS val 457418282 ecr 1224233858], length 0
18:29:27.191813 IP (tos 0x0, ttl 64, id 34415, offset 0, flags [DF], proto TCP (6), length 480)
    10.0.4.15.https > 10.0.4.17.33364: Flags [P.], cksum 0x1df2 (incorrect -> 0xb68a), seq 4358:4786, ack 1, win 1017, options [nop,nop,TS val 1224234948 ecr 457417526], length 428
18:29:27.192141 IP (tos 0x0, ttl 64, id 23974, offset 0, flags [DF], proto TCP (6), length 52)
    10.0.4.17.33364 > 10.0.4.15.https: Flags [.], cksum 0x3cac (correct), seq 1, ack 4786, win 1384, options [nop,nop,TS val 457419372 ecr 1224234948], length 0
18:29:27.192459 IP (tos 0x0, ttl 64, id 23975, offset 0, flags [DF], proto TCP (6), length 94)
    10.0.4.17.33364 > 10.0.4.15.https: Flags [P.], cksum 0x342a (correct), seq 1:43, ack 4786, win 1384, options [nop,nop,TS val 457419372 ecr 1224234948], length 42
18:29:27.192485 IP (tos 0x0, ttl 64, id 34416, offset 0, flags [DF], proto TCP (6), length 52)
    10.0.4.15.https > 10.0.4.17.33364: Flags [.], cksum 0x1c46 (incorrect -> 0x3df0), seq 4786, ack 43, win 1017, options [nop,nop,TS val 1224234949 ecr 457419372], length 0
18:29:27.194790 IP (tos 0x0, ttl 64, id 34417, offset 0, flags [DF], proto TCP (6), length 498)
    10.0.4.15.https > 10.0.4.17.33364: Flags [P.], cksum 0x1e04 (incorrect -> 0x7d5f), seq 4786:5232, ack 43, win 1017, options [nop,nop,TS val 1224234951 ecr 457419372], length 446
18:29:27.236498 IP (tos 0x0, ttl 64, id 23976, offset 0, flags [DF], proto TCP (6), length 52)
    10.0.4.17.33364 > 10.0.4.15.https: Flags [.], cksum 0x3a95 (correct), seq 43, ack 5232, win 1384, options [nop,nop,TS val 457419416 ecr 1224234951], length 0
18:29:27.358665 IP (tos 0x0, ttl 64, id 34418, offset 0, flags [DF], proto TCP (6), length 486)
    10.0.4.15.https > 10.0.4.17.33364: Flags [P.], cksum 0x1df8 (incorrect -> 0x4ccf), seq 5232:5666, ack 43, win 1017, options [nop,nop,TS val 1224235115 ecr 457419416], length 434
18:29:27.358942 IP (tos 0x0, ttl 64, id 23977, offset 0, flags [DF], proto TCP (6), length 52)
    10.0.4.17.33364 > 10.0.4.15.https: Flags [.], cksum 0x37c4 (correct), seq 43, ack 5666, win 1384, options [nop,nop,TS val 457419539 ecr 1224235115], length 0
18:29:29.215341 IP (tos 0x0, ttl 64, id 34419, offset 0, flags [DF], proto TCP (6), length 498)
    10.0.4.15.https > 10.0.4.17.33364: Flags [P.], cksum 0x1e04 (incorrect -> 0x09a4), seq 5666:6112, ack 43, win 1017, options [nop,nop,TS val 1224236971 ecr 457419539], length 446
18:29:29.215570 IP (tos 0x0, ttl 64, id 23978, offset 0, flags [DF], proto TCP (6), length 52)
    10.0.4.17.33364 > 10.0.4.15.https: Flags [.], cksum 0x2786 (correct), seq 43, ack 6112, win 1384, options [nop,nop,TS val 457421395 ecr 1224236971], length 0
18:29:29.217064 IP (tos 0x0, ttl 64, id 34420, offset 0, flags [DF], proto TCP (6), length 480)
    10.0.4.15.https > 10.0.4.17.33364: Flags [P.], cksum 0x1df2 (incorrect -> 0x715b), seq 6112:6540, ack 43, win 1017, options [nop,nop,TS val 1224236973 ecr 457421395], length 428
18:29:29.217262 IP (tos 0x0, ttl 64, id 23979, offset 0, flags [DF], proto TCP (6), length 52)
    10.0.4.17.33364 > 10.0.4.15.https: Flags [.], cksum 0x25d6 (correct), seq 43, ack 6540, win 1384, options [nop,nop,TS val 457421397 ecr 1224236973], length 0
18:29:29.372202 IP (tos 0x0, ttl 64, id 34421, offset 0, flags [DF], proto TCP (6), length 486)
    10.0.4.15.https > 10.0.4.17.33364: Flags [P.], cksum 0x1df8 (incorrect -> 0x9dbf), seq 6540:6974, ack 43, win 1017, options [nop,nop,TS val 1224237128 ecr 457421397], length 434
18:29:29.372416 IP (tos 0x0, ttl 64, id 23980, offset 0, flags [DF], proto TCP (6), length 52)
    10.0.4.17.33364 > 10.0.4.15.https: Flags [.], cksum 0x22ee (correct), seq 43, ack 6974, win 1384, options [nop,nop,TS val 457421552 ecr 1224237128], length 0

```

pod host tcp dump
```
[root@n3 ~]# tcpdump -i any -n port 443 -vvv
tcpdump: listening on any, link-type LINUX_SLL (Linux cooked), capture size 262144 bytes
18:29:16.731172 IP (tos 0x0, ttl 64, id 34399, offset 0, flags [DF], proto TCP (6), length 480)
    10.0.4.15.https > 10.0.4.17.33364: Flags [P.], cksum 0x333b (correct), seq 2172473961:2172474389, ack 4075506649, win 1017, options [nop,nop,TS val 1224224867 ecr 457407467], length 428
18:29:16.731191 IP (tos 0x0, ttl 64, id 23958, offset 0, flags [DF], proto TCP (6), length 52)
    10.0.4.17.33364 > 10.0.4.15.https: Flags [.], cksum 0x1c46 (incorrect -> 0xa524), seq 1, ack 428, win 1384, options [nop,nop,TS val 457409291 ecr 1224224867], length 0
18:29:16.734021 IP (tos 0x0, ttl 64, id 34400, offset 0, flags [DF], proto TCP (6), length 498)
    10.0.4.15.https > 10.0.4.17.33364: Flags [P.], cksum 0x88df (correct), seq 428:874, ack 1, win 1017, options [nop,nop,TS val 1224224870 ecr 457409291], length 446
18:29:16.734035 IP (tos 0x0, ttl 64, id 23959, offset 0, flags [DF], proto TCP (6), length 52)
    10.0.4.17.33364 > 10.0.4.15.https: Flags [.], cksum 0x1c46 (incorrect -> 0xa360), seq 1, ack 874, win 1384, options [nop,nop,TS val 457409294 ecr 1224224870], length 0
18:29:16.917784 IP (tos 0x0, ttl 64, id 34401, offset 0, flags [DF], proto TCP (6), length 486)
    10.0.4.15.https > 10.0.4.17.33364: Flags [P.], cksum 0x0d71 (correct), seq 874:1308, ack 1, win 1017, options [nop,nop,TS val 1224225054 ecr 457409294], length 434
18:29:16.917808 IP (tos 0x0, ttl 64, id 23960, offset 0, flags [DF], proto TCP (6), length 52)
    10.0.4.17.33364 > 10.0.4.15.https: Flags [.], cksum 0x1c46 (incorrect -> 0xa03e), seq 1, ack 1308, win 1384, options [nop,nop,TS val 457409478 ecr 1224225054], length 0
18:29:18.741648 IP (tos 0x0, ttl 64, id 34402, offset 0, flags [DF], proto TCP (6), length 480)
    10.0.4.15.https > 10.0.4.17.33364: Flags [P.], cksum 0xc48f (correct), seq 1308:1736, ack 1, win 1017, options [nop,nop,TS val 1224226878 ecr 457409478], length 428
18:29:18.741676 IP (tos 0x0, ttl 64, id 23961, offset 0, flags [DF], proto TCP (6), length 52)
    10.0.4.17.33364 > 10.0.4.15.https: Flags [.], cksum 0x1c46 (incorrect -> 0x9052), seq 1, ack 1736, win 1384, options [nop,nop,TS val 457411302 ecr 1224226878], length 0
18:29:18.745791 IP (tos 0x0, ttl 64, id 34403, offset 0, flags [DF], proto TCP (6), length 498)
    10.0.4.15.https > 10.0.4.17.33364: Flags [P.], cksum 0xadbc (correct), seq 1736:2182, ack 1, win 1017, options [nop,nop,TS val 1224226882 ecr 457411302], length 446
18:29:18.745805 IP (tos 0x0, ttl 64, id 23962, offset 0, flags [DF], proto TCP (6), length 52)
    10.0.4.17.33364 > 10.0.4.15.https: Flags [.], cksum 0x1c46 (incorrect -> 0x8e8c), seq 1, ack 2182, win 1384, options [nop,nop,TS val 457411306 ecr 1224226882], length 0
18:29:18.745903 IP (tos 0x0, ttl 64, id 23963, offset 0, flags [DF], proto TCP (6), length 94)
    10.0.4.17.33364 > 10.0.4.15.https: Flags [P.], cksum 0x1c70 (incorrect -> 0x0edf), seq 1:43, ack 2182, win 1384, options [nop,nop,TS val 457411306 ecr 1224226882], length 42
18:29:18.746145 IP (tos 0x0, ttl 64, id 34404, offset 0, flags [DF], proto TCP (6), length 52)
    10.0.4.15.https > 10.0.4.17.33364: Flags [.], cksum 0x8fd1 (correct), seq 2182, ack 43, win 1017, options [nop,nop,TS val 1224226882 ecr 457411306], length 0
18:29:18.930361 IP (tos 0x0, ttl 64, id 34405, offset 0, flags [DF], proto TCP (6), length 486)
    10.0.4.15.https > 10.0.4.17.33364: Flags [P.], cksum 0xb446 (correct), seq 2182:2616, ack 43, win 1017, options [nop,nop,TS val 1224227066 ecr 457411306], length 434
18:29:18.970678 IP (tos 0x0, ttl 64, id 23964, offset 0, flags [DF], proto TCP (6), length 52)
    10.0.4.17.33364 > 10.0.4.15.https: Flags [.], cksum 0x1c46 (incorrect -> 0x8b17), seq 43, ack 2616, win 1384, options [nop,nop,TS val 457411531 ecr 1224227066], length 0
18:29:20.759157 IP (tos 0x0, ttl 64, id 34406, offset 0, flags [DF], proto TCP (6), length 480)
    10.0.4.15.https > 10.0.4.17.33364: Flags [P.], cksum 0xc077 (correct), seq 2616:3044, ack 43, win 1017, options [nop,nop,TS val 1224228895 ecr 457411531], length 428
18:29:20.759184 IP (tos 0x0, ttl 64, id 23965, offset 0, flags [DF], proto TCP (6), length 52)
    10.0.4.17.33364 > 10.0.4.15.https: Flags [.], cksum 0x1c46 (incorrect -> 0x7b4a), seq 43, ack 3044, win 1384, options [nop,nop,TS val 457413319 ecr 1224228895], length 0
18:29:20.760721 IP (tos 0x0, ttl 64, id 34407, offset 0, flags [DF], proto TCP (6), length 498)
    10.0.4.15.https > 10.0.4.17.33364: Flags [P.], cksum 0xf433 (correct), seq 3044:3490, ack 43, win 1017, options [nop,nop,TS val 1224228897 ecr 457413319], length 446
18:29:20.760744 IP (tos 0x0, ttl 64, id 23966, offset 0, flags [DF], proto TCP (6), length 52)
    10.0.4.17.33364 > 10.0.4.15.https: Flags [.], cksum 0x1c46 (incorrect -> 0x7988), seq 43, ack 3490, win 1384, options [nop,nop,TS val 457413321 ecr 1224228897], length 0
18:29:20.944282 IP (tos 0x0, ttl 64, id 34408, offset 0, flags [DF], proto TCP (6), length 486)
    10.0.4.15.https > 10.0.4.17.33364: Flags [P.], cksum 0x996a (correct), seq 3490:3924, ack 43, win 1017, options [nop,nop,TS val 1224229080 ecr 457413321], length 434
18:29:20.944305 IP (tos 0x0, ttl 64, id 23967, offset 0, flags [DF], proto TCP (6), length 52)
    10.0.4.17.33364 > 10.0.4.15.https: Flags [.], cksum 0x1c46 (incorrect -> 0x7668), seq 43, ack 3924, win 1384, options [nop,nop,TS val 457413504 ecr 1224229080], length 0
18:29:22.283124 IP (tos 0x0, ttl 64, id 17069, offset 0, flags [DF], proto TCP (6), length 60)
    10.2.2.2.47452 > 10.3.0.1.https: Flags [S], cksum 0x1636 (incorrect -> 0xd159), seq 3851920010, win 29200, options [mss 1460,sackOK,TS val 1296850440 ecr 0,nop,wscale 7], length 0
18:29:22.283124 IP (tos 0x0, ttl 64, id 17069, offset 0, flags [DF], proto TCP (6), length 60)
    10.2.2.2.47452 > 10.0.4.15.https: Flags [S], cksum 0x1a41 (incorrect -> 0xcd4e), seq 3851920010, win 29200, options [mss 1460,sackOK,TS val 1296850440 ecr 0,nop,wscale 7], length 0
18:29:22.283178 IP (tos 0x0, ttl 63, id 17069, offset 0, flags [DF], proto TCP (6), length 60)
    10.2.2.2.47452 > 10.0.4.15.https: Flags [S], cksum 0x1a41 (incorrect -> 0xcd4e), seq 3851920010, win 29200, options [mss 1460,sackOK,TS val 1296850440 ecr 0,nop,wscale 7], length 0
18:29:22.780149 IP (tos 0x0, ttl 64, id 34409, offset 0, flags [DF], proto TCP (6), length 480)
    10.0.4.15.https > 10.0.4.17.33364: Flags [P.], cksum 0xe70c (correct), seq 3924:4352, ack 43, win 1017, options [nop,nop,TS val 1224230916 ecr 457413504], length 428
18:29:22.780165 IP (tos 0x0, ttl 64, id 23968, offset 0, flags [DF], proto TCP (6), length 52)
    10.0.4.17.33364 > 10.0.4.15.https: Flags [.], cksum 0x1c46 (incorrect -> 0x6664), seq 43, ack 4352, win 1384, options [nop,nop,TS val 457415340 ecr 1224230916], length 0
18:29:22.781844 IP (tos 0x0, ttl 64, id 34410, offset 0, flags [DF], proto TCP (6), length 498)
    10.0.4.15.https > 10.0.4.17.33364: Flags [P.], cksum 0x51cb (correct), seq 4352:4798, ack 43, win 1017, options [nop,nop,TS val 1224230918 ecr 457415340], length 446
18:29:22.781857 IP (tos 0x0, ttl 64, id 23969, offset 0, flags [DF], proto TCP (6), length 52)
    10.0.4.17.33364 > 10.0.4.15.https: Flags [.], cksum 0x1c46 (incorrect -> 0x64a2), seq 43, ack 4798, win 1384, options [nop,nop,TS val 457415342 ecr 1224230918], length 0
18:29:22.955805 IP (tos 0x0, ttl 64, id 34411, offset 0, flags [DF], proto TCP (6), length 486)
    10.0.4.15.https > 10.0.4.17.33364: Flags [P.], cksum 0x89b4 (correct), seq 4798:5232, ack 43, win 1017, options [nop,nop,TS val 1224231092 ecr 457415342], length 434
18:29:22.955829 IP (tos 0x0, ttl 64, id 23970, offset 0, flags [DF], proto TCP (6), length 52)
    10.0.4.17.33364 > 10.0.4.15.https: Flags [.], cksum 0x1c46 (incorrect -> 0x6194), seq 43, ack 5232, win 1384, options [nop,nop,TS val 457415516 ecr 1224231092], length 0
18:29:23.331710 IP (tos 0x0, ttl 64, id 17070, offset 0, flags [DF], proto TCP (6), length 60)
    10.2.2.2.47452 > 10.3.0.1.https: Flags [S], cksum 0x1636 (incorrect -> 0xcd40), seq 3851920010, win 29200, options [mss 1460,sackOK,TS val 1296851489 ecr 0,nop,wscale 7], length 0
18:29:23.331710 IP (tos 0x0, ttl 64, id 17070, offset 0, flags [DF], proto TCP (6), length 60)
    10.2.2.2.47452 > 10.0.4.15.https: Flags [S], cksum 0x1a41 (incorrect -> 0xc935), seq 3851920010, win 29200, options [mss 1460,sackOK,TS val 1296851489 ecr 0,nop,wscale 7], length 0
18:29:23.331766 IP (tos 0x0, ttl 63, id 17070, offset 0, flags [DF], proto TCP (6), length 60)
    10.2.2.2.47452 > 10.0.4.15.https: Flags [S], cksum 0x1a41 (incorrect -> 0xc935), seq 3851920010, win 29200, options [mss 1460,sackOK,TS val 1296851489 ecr 0,nop,wscale 7], length 0
18:29:24.797574 IP (tos 0x0, ttl 64, id 34412, offset 0, flags [DF], proto TCP (6), length 480)
    10.0.4.15.https > 10.0.4.17.33364: Flags [P.], cksum 0xab1e (correct), seq 5232:5660, ack 43, win 1017, options [nop,nop,TS val 1224232934 ecr 457415516], length 428
18:29:24.797590 IP (tos 0x0, ttl 64, id 23971, offset 0, flags [DF], proto TCP (6), length 52)
    10.0.4.17.33364 > 10.0.4.15.https: Flags [.], cksum 0x1c46 (incorrect -> 0x5185), seq 43, ack 5660, win 1384, options [nop,nop,TS val 457417357 ecr 1224232934], length 0
18:29:24.799789 IP (tos 0x0, ttl 64, id 34413, offset 0, flags [DF], proto TCP (6), length 498)
    10.0.4.15.https > 10.0.4.17.33364: Flags [P.], cksum 0x4489 (correct), seq 5660:6106, ack 43, win 1017, options [nop,nop,TS val 1224232936 ecr 457417357], length 446
18:29:24.799802 IP (tos 0x0, ttl 64, id 23972, offset 0, flags [DF], proto TCP (6), length 52)
    10.0.4.17.33364 > 10.0.4.15.https: Flags [.], cksum 0x1c46 (incorrect -> 0x4fc2), seq 43, ack 6106, win 1384, options [nop,nop,TS val 457417360 ecr 1224232936], length 0
18:29:24.966153 IP (tos 0x0, ttl 64, id 34414, offset 0, flags [DF], proto TCP (6), length 486)
    10.0.4.15.https > 10.0.4.17.33364: Flags [P.], cksum 0x94eb (correct), seq 6106:6540, ack 43, win 1017, options [nop,nop,TS val 1224233102 ecr 457417360], length 434
18:29:24.966171 IP (tos 0x0, ttl 64, id 23973, offset 0, flags [DF], proto TCP (6), length 52)
    10.0.4.17.33364 > 10.0.4.15.https: Flags [.], cksum 0x1c46 (incorrect -> 0x4cc4), seq 43, ack 6540, win 1384, options [nop,nop,TS val 457417526 ecr 1224233102], length 0
18:29:25.397121 IP (tos 0x0, ttl 64, id 40287, offset 0, flags [DF], proto TCP (6), length 60)
    10.2.2.2.47454 > 10.3.0.1.https: Flags [S], cksum 0x1636 (incorrect -> 0xcf96), seq 212562190, win 29200, options [mss 1460,sackOK,TS val 1296853554 ecr 0,nop,wscale 7], length 0
18:29:25.397121 IP (tos 0x0, ttl 64, id 40287, offset 0, flags [DF], proto TCP (6), length 60)
    10.2.2.2.47454 > 10.0.4.15.https: Flags [S], cksum 0x1a41 (incorrect -> 0xcb8b), seq 212562190, win 29200, options [mss 1460,sackOK,TS val 1296853554 ecr 0,nop,wscale 7], length 0
18:29:25.397165 IP (tos 0x0, ttl 63, id 40287, offset 0, flags [DF], proto TCP (6), length 60)
    10.2.2.2.47454 > 10.0.4.15.https: Flags [S], cksum 0x1a41 (incorrect -> 0xcb8b), seq 212562190, win 29200, options [mss 1460,sackOK,TS val 1296853554 ecr 0,nop,wscale 7], length 0
18:29:25.704819 IP (tos 0x0, ttl 64, id 15333, offset 0, flags [DF], proto TCP (6), length 97)
    10.0.4.17.33358 > 10.0.4.15.https: Flags [P.], cksum 0x1c73 (incorrect -> 0x2e65), seq 4119205422:4119205467, ack 3698809196, win 1384, options [nop,nop,TS val 457418265 ecr 1224223841], length 45
18:29:25.706963 IP (tos 0x0, ttl 64, id 56584, offset 0, flags [DF], proto TCP (6), length 117)
    10.0.4.15.https > 10.0.4.17.33358: Flags [P.], cksum 0xbfd2 (correct), seq 1:66, ack 45, win 1392, options [nop,nop,TS val 1224233843 ecr 457418265], length 65
18:29:25.707087 IP (tos 0x0, ttl 64, id 56585, offset 0, flags [DF], proto TCP (6), length 2694)
    10.0.4.15.https > 10.0.4.17.33358: Flags [P.], cksum 0x2698 (incorrect -> 0x1fbd), seq 66:2708, ack 45, win 1392, options [nop,nop,TS val 1224233843 ecr 457418265], length 2642
18:29:25.707129 IP (tos 0x0, ttl 64, id 15334, offset 0, flags [DF], proto TCP (6), length 52)
    10.0.4.17.33358 > 10.0.4.15.https: Flags [.], cksum 0x1c46 (incorrect -> 0x2709), seq 45, ack 2708, win 1384, options [nop,nop,TS val 457418267 ecr 1224233843], length 0
18:29:25.709083 IP (tos 0x0, ttl 64, id 15335, offset 0, flags [DF], proto TCP (6), length 99)
    10.0.4.17.33358 > 10.0.4.15.https: Flags [P.], cksum 0x1c75 (incorrect -> 0x8536), seq 45:92, ack 2708, win 1384, options [nop,nop,TS val 457418269 ecr 1224233843], length 47
18:29:25.709209 IP (tos 0x0, ttl 64, id 15336, offset 0, flags [DF], proto TCP (6), length 2678)
    10.0.4.17.33358 > 10.0.4.15.https: Flags [P.], cksum 0x2688 (incorrect -> 0x0765), seq 92:2718, ack 2708, win 1384, options [nop,nop,TS val 457418269 ecr 1224233843], length 2626
18:29:25.709231 IP (tos 0x0, ttl 64, id 15338, offset 0, flags [DF], proto TCP (6), length 90)
    10.0.4.17.33358 > 10.0.4.15.https: Flags [P.], cksum 0x1c6c (incorrect -> 0x5db1), seq 2718:2756, ack 2708, win 1384, options [nop,nop,TS val 457418269 ecr 1224233843], length 38
18:29:25.709789 IP (tos 0x0, ttl 64, id 56587, offset 0, flags [DF], proto TCP (6), length 52)
    10.0.4.15.https > 10.0.4.17.33358: Flags [.], cksum 0x1c65 (correct), seq 2708, ack 2756, win 1392, options [nop,nop,TS val 1224233846 ecr 457418269], length 0
18:29:25.710787 IP (tos 0x0, ttl 64, id 56588, offset 0, flags [DF], proto TCP (6), length 120)
    10.0.4.15.https > 10.0.4.17.33358: Flags [P.], cksum 0x5cd2 (correct), seq 2708:2776, ack 2756, win 1392, options [nop,nop,TS val 1224233847 ecr 457418269], length 68
18:29:25.720899 IP (tos 0x0, ttl 64, id 56589, offset 0, flags [DF], proto TCP (6), length 1500)
    10.0.4.15.https > 10.0.4.17.33358: Flags [.], cksum 0x5768 (correct), seq 2776:4224, ack 2756, win 1392, options [nop,nop,TS val 1224233857 ecr 457418269], length 1448
18:29:25.720948 IP (tos 0x0, ttl 64, id 15339, offset 0, flags [DF], proto TCP (6), length 52)
    10.0.4.17.33358 > 10.0.4.15.https: Flags [.], cksum 0x1c46 (incorrect -> 0x1674), seq 2756, ack 4224, win 1384, options [nop,nop,TS val 457418281 ecr 1224233847], length 0
18:29:25.721108 IP (tos 0x0, ttl 64, id 56590, offset 0, flags [DF], proto TCP (6), length 1247)
    10.0.4.15.https > 10.0.4.17.33358: Flags [P.], cksum 0x83fe (correct), seq 4224:5419, ack 2756, win 1392, options [nop,nop,TS val 1224233857 ecr 457418269], length 1195
18:29:25.721237 IP (tos 0x0, ttl 64, id 15340, offset 0, flags [DF], proto TCP (6), length 94)
    10.0.4.17.33358 > 10.0.4.15.https: Flags [P.], cksum 0x1c70 (incorrect -> 0x6df1), seq 2756:2798, ack 5419, win 1384, options [nop,nop,TS val 457418281 ecr 1224233857], length 42
18:29:25.721834 IP (tos 0x0, ttl 64, id 56591, offset 0, flags [DF], proto TCP (6), length 2683)
    10.0.4.15.https > 10.0.4.17.33358: Flags [P.], cksum 0x268d (incorrect -> 0x239b), seq 5419:8050, ack 2798, win 1392, options [nop,nop,TS val 1224233858 ecr 457418281], length 2631
18:29:25.721894 IP (tos 0x0, ttl 64, id 15341, offset 0, flags [DF], proto TCP (6), length 52)
    10.0.4.17.33358 > 10.0.4.15.https: Flags [.], cksum 0x1c46 (incorrect -> 0x074c), seq 2798, ack 8050, win 1384, options [nop,nop,TS val 457418282 ecr 1224233858], length 0
18:29:26.811871 IP (tos 0x0, ttl 64, id 34415, offset 0, flags [DF], proto TCP (6), length 480)
    10.0.4.15.https > 10.0.4.17.33364: Flags [P.], cksum 0xb68a (correct), seq 6540:6968, ack 43, win 1017, options [nop,nop,TS val 1224234948 ecr 457417526], length 428
18:29:26.811897 IP (tos 0x0, ttl 64, id 23974, offset 0, flags [DF], proto TCP (6), length 52)
    10.0.4.17.33364 > 10.0.4.15.https: Flags [.], cksum 0x1c46 (incorrect -> 0x3cac), seq 43, ack 6968, win 1384, options [nop,nop,TS val 457419372 ecr 1224234948], length 0
18:29:26.812209 IP (tos 0x0, ttl 64, id 23975, offset 0, flags [DF], proto TCP (6), length 94)
    10.0.4.17.33364 > 10.0.4.15.https: Flags [P.], cksum 0x1c70 (incorrect -> 0x342a), seq 43:85, ack 6968, win 1384, options [nop,nop,TS val 457419372 ecr 1224234948], length 42
18:29:26.812426 IP (tos 0x0, ttl 64, id 34416, offset 0, flags [DF], proto TCP (6), length 52)
    10.0.4.15.https > 10.0.4.17.33364: Flags [.], cksum 0x3df0 (correct), seq 6968, ack 85, win 1017, options [nop,nop,TS val 1224234949 ecr 457419372], length 0
18:29:26.814776 IP (tos 0x0, ttl 64, id 34417, offset 0, flags [DF], proto TCP (6), length 498)
    10.0.4.15.https > 10.0.4.17.33364: Flags [P.], cksum 0x7d5f (correct), seq 6968:7414, ack 85, win 1017, options [nop,nop,TS val 1224234951 ecr 457419372], length 446
18:29:26.855668 IP (tos 0x0, ttl 64, id 23976, offset 0, flags [DF], proto TCP (6), length 52)
    10.0.4.17.33364 > 10.0.4.15.https: Flags [.], cksum 0x1c46 (incorrect -> 0x3a95), seq 85, ack 7414, win 1384, options [nop,nop,TS val 457419416 ecr 1224234951], length 0
18:29:26.978677 IP (tos 0x0, ttl 64, id 34418, offset 0, flags [DF], proto TCP (6), length 486)
    10.0.4.15.https > 10.0.4.17.33364: Flags [P.], cksum 0x4ccf (correct), seq 7414:7848, ack 85, win 1017, options [nop,nop,TS val 1224235115 ecr 457419416], length 434
18:29:26.978704 IP (tos 0x0, ttl 64, id 23977, offset 0, flags [DF], proto TCP (6), length 52)
    10.0.4.17.33364 > 10.0.4.15.https: Flags [.], cksum 0x1c46 (incorrect -> 0x37c4), seq 85, ack 7848, win 1384, options [nop,nop,TS val 457419539 ecr 1224235115], length 0
18:29:27.177737 IP (tos 0x0, ttl 64, id 20629, offset 0, flags [DF], proto TCP (6), length 60)
    10.2.2.2.47456 > 10.3.0.1.https: Flags [S], cksum 0x1636 (incorrect -> 0x91f3), seq 278045651, win 29200, options [mss 1460,sackOK,TS val 1296855335 ecr 0,nop,wscale 7], length 0
18:29:27.177737 IP (tos 0x0, ttl 64, id 20629, offset 0, flags [DF], proto TCP (6), length 60)
    10.2.2.2.47456 > 10.0.4.15.https: Flags [S], cksum 0x1a41 (incorrect -> 0x8de8), seq 278045651, win 29200, options [mss 1460,sackOK,TS val 1296855335 ecr 0,nop,wscale 7], length 0
18:29:27.177790 IP (tos 0x0, ttl 63, id 20629, offset 0, flags [DF], proto TCP (6), length 60)
    10.2.2.2.47456 > 10.0.4.15.https: Flags [S], cksum 0x1a41 (incorrect -> 0x8de8), seq 278045651, win 29200, options [mss 1460,sackOK,TS val 1296855335 ecr 0,nop,wscale 7], length 0
18:29:28.835310 IP (tos 0x0, ttl 64, id 34419, offset 0, flags [DF], proto TCP (6), length 498)
    10.0.4.15.https > 10.0.4.17.33364: Flags [P.], cksum 0x09a4 (correct), seq 7848:8294, ack 85, win 1017, options [nop,nop,TS val 1224236971 ecr 457419539], length 446
18:29:28.835339 IP (tos 0x0, ttl 64, id 23978, offset 0, flags [DF], proto TCP (6), length 52)
    10.0.4.17.33364 > 10.0.4.15.https: Flags [.], cksum 0x1c46 (incorrect -> 0x2786), seq 85, ack 8294, win 1384, options [nop,nop,TS val 457421395 ecr 1224236971], length 0
18:29:28.837003 IP (tos 0x0, ttl 64, id 34420, offset 0, flags [DF], proto TCP (6), length 480)
    10.0.4.15.https > 10.0.4.17.33364: Flags [P.], cksum 0x715b (correct), seq 8294:8722, ack 85, win 1017, options [nop,nop,TS val 1224236973 ecr 457421395], length 428
18:29:28.837023 IP (tos 0x0, ttl 64, id 23979, offset 0, flags [DF], proto TCP (6), length 52)
    10.0.4.17.33364 > 10.0.4.15.https: Flags [.], cksum 0x1c46 (incorrect -> 0x25d6), seq 85, ack 8722, win 1384, options [nop,nop,TS val 457421397 ecr 1224236973], length 0
18:29:28.992148 IP (tos 0x0, ttl 64, id 34421, offset 0, flags [DF], proto TCP (6), length 486)
    10.0.4.15.https > 10.0.4.17.33364: Flags [P.], cksum 0x9dbf (correct), seq 8722:9156, ack 85, win 1017, options [nop,nop,TS val 1224237128 ecr 457421397], length 434
18:29:28.992170 IP (tos 0x0, ttl 64, id 23980, offset 0, flags [DF], proto TCP (6), length 52)
    10.0.4.17.33364 > 10.0.4.15.https: Flags [.], cksum 0x1c46 (incorrect -> 0x22ee), seq 85, ack 9156, win 1384, options [nop,nop,TS val 457421552 ecr 1224237128], length 0
18:29:30.848380 IP (tos 0x0, ttl 64, id 34422, offset 0, flags [DF], proto TCP (6), length 498)
    10.0.4.15.https > 10.0.4.17.33364: Flags [P.], cksum 0x71b6 (correct), seq 9156:9602, ack 85, win 1017, options [nop,nop,TS val 1224238985 ecr 457421552], length 446
18:29:30.848406 IP (tos 0x0, ttl 64, id 23981, offset 0, flags [DF], proto TCP (6), length 52)
    10.0.4.17.33364 > 10.0.4.15.https: Flags [.], cksum 0x1c46 (incorrect -> 0x12af), seq 85, ack 9602, win 1384, options [nop,nop,TS val 457423408 ecr 1224238985], length 0
18:29:30.849237 IP (tos 0x0, ttl 64, id 34423, offset 0, flags [DF], proto TCP (6), length 480)
    10.0.4.15.https > 10.0.4.17.33364: Flags [P.], cksum 0xb661 (correct), seq 9602:10030, ack 85, win 1017, options [nop,nop,TS val 1224238985 ecr 457423408], length 428
18:29:30.849260 IP (tos 0x0, ttl 64, id 23982, offset 0, flags [DF], proto TCP (6), length 52)
    10.0.4.17.33364 > 10.0.4.15.https: Flags [.], cksum 0x1c46 (incorrect -> 0x1102), seq 85, ack 10030, win 1384, options [nop,nop,TS val 457423409 ecr 1224238985], length 0
18:29:31.009331 IP (tos 0x0, ttl 64, id 34424, offset 0, flags [DF], proto TCP (6), length 486)
    10.0.4.15.https > 10.0.4.17.33364: Flags [P.], cksum 0x429e (correct), seq 10030:10464, ack 85, win 1017, options [nop,nop,TS val 1224239145 ecr 457423409], length 434
18:29:31.009353 IP (tos 0x0, ttl 64, id 23983, offset 0, flags [DF], proto TCP (6), length 52)
    10.0.4.17.33364 > 10.0.4.15.https: Flags [.], cksum 0x1c46 (incorrect -> 0x0e10), seq 85, ack 10464, win 1384, options [nop,nop,TS val 457423569 ecr 1224239145], length 0

```

I didn't see package arrive api server like id 17070 , is pod host DNAT has some problem?

**Comment by adieu** [comment]
i think `10.0.4.0/24` is the subnet for all the hosts. and `10.2.0.0/16` is the subnet for pods.

from the tcpdump, i could see traffic from `10.0.4.17` to `10.0.4.15`. i'm not sure if you're testing host to host connection during tcpdump or your host is doing nat for the pods. if you didn't disable nat for docker, you can do that with `--ip-masq=false` . Check https://docs.docker.com/engine/reference/commandline/dockerd/ for detailed configure.

To make kubernetes networking working, pods should be able to connect to each other without nat. so we should see traffic between two endpoints in the `10.2.0.0/16` ip range during tcpdump.

**Comment by abriko** [comment]
Ok, thanks of your help, I will try it.
